{
  "id": "vampire",
  "name": "Vampire",
  "description": "An undead creature that drains life from its victims.",
  "tier": 3,
  "level": 18,
  "stats": {
    "health": 350,
    "maxHealth": 350,
    "mana": 120,
    "maxMana": 120,
    "attack": 55,
    "defense": 22,
    "magicAttack": 45,
    "magicDefense": 28,
    "speed": 20,
    "criticalChance": 15,
    "criticalDamage": 2.0
  },
  "lootTable": [
    {
      "itemId": "gold",
      "chance": 1.0,
      "min": 120,
      "max": 180
    },
    {
      "itemId": "vampire_fang",
      "chance": 0.4
    },
    {
      "itemId": "blood_crystal",
      "chance": 0.25
    }
  ],
  "experienceReward": 250,
  "goldReward": {
    "min": 120,
    "max": 180
  }
}

