{
  "id": "orc_warrior",
  "name": "Orc Warrior",
  "description": "A heavily armored orc warrior trained for combat.",
  "tier": 2,
  "level": 8,
  "stats": {
    "health": 180,
    "maxHealth": 180,
    "mana": 0,
    "maxMana": 0,
    "attack": 40,
    "defense": 20,
    "magicAttack": 0,
    "magicDefense": 8,
    "speed": 9,
    "criticalChance": 5,
    "criticalDamage": 1.6
  },
  "lootTable": [
    {
      "itemId": "gold",
      "chance": 1.0,
      "min": 45,
      "max": 70
    },
    {
      "itemId": "iron_ore",
      "chance": 0.3
    }
  ],
  "experienceReward": 95,
  "goldReward": {
    "min": 45,
    "max": 70
  }
}

