{
  "id": "ghost",
  "name": "Ghost",
  "description": "A spectral entity that can phase through attacks.",
  "tier": 2,
  "level": 6,
  "stats": {
    "health": 95,
    "maxHealth": 95,
    "mana": 60,
    "maxMana": 60,
    "attack": 16,
    "defense": 6,
    "magicAttack": 28,
    "magicDefense": 22,
    "speed": 17,
    "criticalChance": 9,
    "criticalDamage": 1.7
  },
  "lootTable": [
    {
      "itemId": "gold",
      "chance": 1,
      "min": 28,
      "max": 45
    },
    {
      "itemId": "ectoplasm",
      "chance": 0.4
    }
  ],
  "experienceReward": 55,
  "goldReward": {
    "min": 28,
    "max": 45
  },
  "nameKey": "monster.ghost.name",
  "descriptionKey": "monster.ghost.description"
}
